bake,"a dish consisting of mixed ingredients that is cooked in the oven"
you,used to refer to the person or people that the speaker is addressing
if,something that is not yet certain or not yet decided
many,a large number of; the majority of people
most,greatest in amount or degree
other,"used to refer to a person or thing that is different or distinct from one already mentioned or known about"
she,a female; a woman
long,a long interval or period
physical,medical examination to determine a person's bodily fitness
ask,"a request, especially for a donation"
creative,"a person who is creative, typically in a professional context"
effective,a soldier fit and available for service
visual,"a picture, piece of film, or display used to illustrate or accompany something"
beyond,the unknown after death
unique,a unique person or thing
anything,used to refer to a thing; used to indicate a range; used for emphasis
comfortable,a warm quilt
maybe,a mere possibility or probability
fail,a grade that is not high enough to pass an examination or test
listen,an act of listening to something
eat,food or snacks
vast,an immense space
anywhere,any place
consist,a set of railroad vehicles forming a complete train
internal,inner parts or features
nasty,an unpleasant or harmful person or thing
respond,"a half-pillar or half-pier attached to a wall to support an arch, especially at the end of an arcade"
usual,the thing that is typically done or present
abroad,foreign countries considered collectively
reveal,a final revelation of information that has previously been kept from the characters or viewers
anybody,anyone
brilliant,a diamond of brilliant cut
resist,"a resistant substance applied as a coating to protect a surface during some process, for example to prevent dye or glaze adhering."